{"$schema":"../../schemas/ble-profile-v1.schema.json","schemaVersion":1,"id":"shelly-sbdw-002c","version":1,"minimumRuntimeVersion":1,"status":"experimental","protocol":"BTHome v2 service-data advertisement","match":{"namePatterns":["^SBDW-002C"],"serviceDataUuids":["fcd2"]},"source":{"name":"Theengs Decoder ShellyBLU Door/Window protocol facts","url":"https://github.com/theengs/decoder/blob/development/src/devices/SBDW_002C_json.h","license":"Protocol facts independently re-expressed in HomeController DeviceDB; Theengs Decoder implementation is GPL-3.0.","notes":"ShellyBLU Door/Window BTHome payload; hardware-unverified."},"fields":[{"code":"packet","name":"Packet id","unit":"int","input":{"kind":"serviceData","serviceUuid":"fcd2"},"decode":{"type":"uint8","offset":2}},{"code":"battery","name":"Battery","unit":"%","input":{"kind":"serviceData","serviceUuid":"fcd2"},"decode":{"type":"uint8","offset":4,"minimum":0,"maximum":100}},{"code":"illuminance","name":"Illuminance","unit":"lux","input":{"kind":"serviceData","serviceUuid":"fcd2"},"decode":{"type":"uint24le","offset":6,"scale":0.01}},{"code":"open","name":"Door","unit":"status","input":{"kind":"serviceData","serviceUuid":"fcd2"},"decode":{"type":"uint8","offset":10,"mask":1,"enum":{"0":"closed","1":"open"}}},{"code":"rotation","name":"Rotation","unit":"°","input":{"kind":"serviceData","serviceUuid":"fcd2"},"decode":{"type":"int16le","offset":12,"scale":0.1}}]}