{"$schema":"../../schemas/ble-profile-v1.schema.json","schemaVersion":1,"id":"xiaomi-lywsd02","version":1,"minimumRuntimeVersion":1,"status":"experimental","protocol":"Xiaomi FE95 service-data advertisement","match":{"serviceDataUuids":["fe95"]},"source":{"name":"Theengs Decoder LYWSD02 protocol facts","url":"https://github.com/theengs/decoder/blob/development/src/devices/LYWSD02_json.h","license":"Protocol facts independently re-expressed in HomeController DeviceDB; Theengs Decoder implementation is GPL-3.0.","notes":"LYWSD02 e-ink clock, Xiaomi product marker 5b04; hardware-unverified."},"fields":[{"code":"temperature","name":"Temperature","unit":"°C","input":{"kind":"serviceData","serviceUuid":"fe95"},"decode":{"type":"int16le","offset":15,"scale":0.1}},{"code":"humidity","name":"Humidity","unit":"%","input":{"kind":"serviceData","serviceUuid":"fe95"},"decode":{"type":"uint16le","offset":15,"scale":0.1}},{"code":"battery","name":"Battery","unit":"%","input":{"kind":"serviceData","serviceUuid":"fe95"},"decode":{"type":"uint8","offset":15,"minimum":0,"maximum":100}}]}