{"$schema":"../../schemas/ble-profile-v1.schema.json","schemaVersion":1,"id":"inkbird-ibt-6x","version":1,"minimumRuntimeVersion":1,"status":"experimental","protocol":"Theengs-derived Inkbird/Tenergy iBBQ advertisement","match":{"namePatterns":["iBBQ"]},"source":{"name":"Theengs Decoder IBT-6X(S)/SOLIS-6","url":"https://github.com/theengs/decoder/blob/development/src/devices/IBT_6XS_SOLIS6_json.h","license":"GPL-3.0","notes":"Six-probe Inkbird packet; shared wire format with SOLIS-6; hardware unverified."},"fields":[{"code":"temperature1","name":"Probe 1 temperature","unit":"°C","input":{"kind":"manufacturerData"},"decode":{"type":"int16le","offset":10,"scale":0.1}},{"code":"temperature2","name":"Probe 2 temperature","unit":"°C","input":{"kind":"manufacturerData"},"decode":{"type":"int16le","offset":12,"scale":0.1}},{"code":"temperature3","name":"Probe 3 temperature","unit":"°C","input":{"kind":"manufacturerData"},"decode":{"type":"int16le","offset":14,"scale":0.1}},{"code":"temperature4","name":"Probe 4 temperature","unit":"°C","input":{"kind":"manufacturerData"},"decode":{"type":"int16le","offset":16,"scale":0.1}},{"code":"temperature5","name":"Probe 5 temperature","unit":"°C","input":{"kind":"manufacturerData"},"decode":{"type":"int16le","offset":18,"scale":0.1}},{"code":"temperature6","name":"Probe 6 temperature","unit":"°C","input":{"kind":"manufacturerData"},"decode":{"type":"int16le","offset":20,"scale":0.1}}]}