{"$schema":"../../schemas/ble-profile-v1.schema.json","schemaVersion":1,"id":"govee-h5179","version":1,"minimumRuntimeVersion":1,"status":"experimental","protocol":"Govee H5179 manufacturer advertisement","match":{"namePatterns":["^Govee_H5179.*$"]},"source":{"name":"Theengs Decoder H5179 protocol facts","url":"https://github.com/theengs/decoder/blob/development/src/devices/H5179_json.h","license":"Protocol facts independently re-expressed in HomeController DeviceDB; Theengs Decoder implementation is GPL-3.0.","notes":"Classic H5179 advertisement variant. Correct little-endian temperature/humidity decoding per Theengs reverse-endianness flag; hardware-unverified."},"fields":[{"code":"temperature","name":"Temperature","unit":"°C","input":{"kind":"manufacturerData"},"decode":{"type":"int16le","offset":6,"scale":0.01}},{"code":"humidity","name":"Humidity","unit":"%","input":{"kind":"manufacturerData"},"decode":{"type":"uint16le","offset":8,"scale":0.01,"minimum":0,"maximum":100}},{"code":"battery","name":"Battery","unit":"%","input":{"kind":"manufacturerData"},"decode":{"type":"uint8","offset":10,"minimum":0,"maximum":100}}]}
