{"$schema":"../../schemas/ble-profile-v1.schema.json","schemaVersion":1,"id":"radioland-rdl52832","version":1,"minimumRuntimeVersion":1,"status":"experimental","protocol":"Radioland RDL52832 iBeacon + sensor service-data advertisement","match":{"namePatterns":["^RDL52832"],"serviceDataUuids":["0318"]},"source":{"name":"Theengs Decoder RDL52832 protocol facts","url":"https://github.com/theengs/decoder/blob/development/src/devices/RDL52832_json.h","license":"Protocol facts independently re-expressed in HomeController DeviceDB; Theengs Decoder implementation is GPL-3.0.","notes":"RDL52832 sensor iBeacon; hardware-unverified."},"fields":[{"code":"temperature","name":"Temperature","unit":"°C","input":{"kind":"serviceData","serviceUuid":"0318"},"decode":{"type":"int16be","offset":0,"scale":0.00390625}},{"code":"humidity","name":"Humidity","unit":"%","input":{"kind":"serviceData","serviceUuid":"0318"},"decode":{"type":"uint16be","offset":2,"scale":0.00390625}}]}