{"$schema":"../../schemas/ble-profile-v1.schema.json","schemaVersion":1,"id":"switchbot-bot-x1","version":1,"minimumRuntimeVersion":1,"status":"experimental","protocol":"SwitchBot Bot advertisement","match":{"serviceUuids":["0d00","fd3d"]},"source":{"name":"Theengs Decoder SBS1 research reference","url":"https://github.com/theengs/decoder/blob/development/src/devices/SBS1_json.h","license":"GPL-3.0 research reference only","notes":"Independent HomeController profile for SwitchBot Bot X1; hardware-unverified."},"fields":[{"code":"modeRaw","name":"Mode","input":{"kind":"serviceData","serviceUuid":"fd3d"},"decode":{"type":"uint8","offset":1,"mask":8,"shift":3}},{"code":"stateRaw","name":"State","input":{"kind":"serviceData","serviceUuid":"fd3d"},"decode":{"type":"uint8","offset":1,"mask":4,"shift":2}},{"code":"battery","name":"Battery","unit":"%","input":{"kind":"serviceData","serviceUuid":"fd3d"},"decode":{"type":"uint8","offset":2,"mask":127}}]}
