{"$schema":"../../schemas/ble-profile-v1.schema.json","schemaVersion":1,"id":"shelly-sbbt-002c","version":1,"minimumRuntimeVersion":1,"status":"experimental","protocol":"BTHome v2 service-data advertisement","match":{"namePatterns":["^SBBT-002C"],"serviceDataUuids":["fcd2"]},"source":{"name":"Theengs Decoder ShellyBLU Button1 protocol facts","url":"https://github.com/theengs/decoder/blob/development/src/devices/SBBT_002C_json.h","license":"Protocol facts independently re-expressed in HomeController DeviceDB; Theengs Decoder implementation is GPL-3.0.","notes":"ShellyBLU Button1 BTHome payload; hardware-unverified."},"fields":[{"code":"packet","name":"Packet id","unit":"int","input":{"kind":"serviceData","serviceUuid":"fcd2"},"decode":{"type":"uint8","offset":2}},{"code":"battery","name":"Battery","unit":"%","input":{"kind":"serviceData","serviceUuid":"fcd2"},"decode":{"type":"uint8","offset":4,"minimum":0,"maximum":100}},{"code":"button","name":"Button press type","unit":"event","input":{"kind":"serviceData","serviceUuid":"fcd2"},"decode":{"type":"uint8","offset":6,"enum":{"0":"none","1":"single","2":"double","3":"triple","4":"long","254":"hold"}}}]}