{"$schema":"../../schemas/ble-profile-v1.schema.json","schemaVersion":1,"id":"sensorpush-sphtp","version":1,"minimumRuntimeVersion":1,"status":"experimental","protocol":"SensorPush advertisement","match":{"namePatterns":["SensorPush HTP*","HTP.xw*"]},"source":{"name":"Theengs Decoder SPHTP protocol facts","url":"https://github.com/theengs/decoder/blob/development/src/devices/SPHTP_json.h","license":"Protocol facts independently re-expressed in HomeController DeviceDB; Theengs Decoder implementation is GPL-3.0.","notes":"SensorPush HTP.xw; hardware-unverified."},"fields":[{"code":"temperature","name":"Temperature","unit":"°C","input":{"kind":"manufacturerData"},"decode":{"type":"int16le","offset":0,"scale":0.01}},{"code":"humidity","name":"Humidity","unit":"%","input":{"kind":"manufacturerData"},"decode":{"type":"uint16le","offset":2,"scale":0.01}},{"code":"pressure","name":"Pressure","unit":"hPa","input":{"kind":"manufacturerData"},"decode":{"type":"uint24le","offset":4,"scale":0.01}}]}