{"$schema":"../../schemas/ble-profile-v1.schema.json","schemaVersion":1,"id":"rbaron-b-parasite-v2","version":1,"minimumRuntimeVersion":1,"status":"experimental","protocol":"BTHome/FCD2 service data","match":{"namePatterns":[".*prst.*"],"serviceDataUuids":["FCD2"]},"source":{"name":"Theengs Decoder BPARASITEV2 protocol facts","url":"https://github.com/theengs/decoder/blob/development/src/devices/BPARASITEV2_json.h","license":"Protocol facts independently re-expressed in HomeController DeviceDB; Theengs Decoder implementation is GPL-3.0.","notes":"b-parasite v2.0 fixed BTHome advertisement layout; hardware-unverified."},"fields":[{"code":"battery","name":"Battery","unit":"%","input":{"kind":"serviceData","serviceUuid":"FCD2"},"decode":{"type":"uint8","offset":2,"minimum":0,"maximum":100}},{"code":"temperature","name":"Temperature","unit":"°C","input":{"kind":"serviceData","serviceUuid":"FCD2"},"decode":{"type":"int16le","offset":4,"scale":0.01}},{"code":"illuminance","name":"Illuminance","unit":"lx","input":{"kind":"serviceData","serviceUuid":"FCD2"},"decode":{"type":"uint24le","offset":7,"scale":0.01}},{"code":"voltage","name":"Voltage","unit":"V","input":{"kind":"serviceData","serviceUuid":"FCD2"},"decode":{"type":"uint16le","offset":11,"scale":0.001}},{"code":"humidity","name":"Humidity","unit":"%","input":{"kind":"serviceData","serviceUuid":"FCD2"},"decode":{"type":"uint8","offset":14,"minimum":0,"maximum":100}},{"code":"moisture","name":"Soil moisture","unit":"%","input":{"kind":"serviceData","serviceUuid":"FCD2"},"decode":{"type":"uint8","offset":16,"minimum":0,"maximum":100}}]}
