{"$schema":"../../schemas/ble-profile-v1.schema.json","schemaVersion":1,"id":"shellyblu-motion","version":1,"minimumRuntimeVersion":1,"status":"experimental","protocol":"Shelly BTHome service-data advertisement","match":{"namePatterns":["SBMO-*"],"serviceDataUuids":["fcd2"]},"source":{"name":"Theengs Decoder SBMO-003Z protocol facts","url":"https://github.com/theengs/decoder/blob/development/src/devices/SBMO_003Z_json.h","license":"Protocol facts independently re-expressed in HomeController DeviceDB; Theengs Decoder implementation is GPL-3.0.","notes":"Unencrypted ShellyBLU Motion; hardware-unverified."},"fields":[{"code":"packet","name":"Packet id","unit":"int","input":{"kind":"serviceData","serviceUuid":"fcd2"},"decode":{"type":"uint8","offset":2}},{"code":"battery","name":"Battery","unit":"%","input":{"kind":"serviceData","serviceUuid":"fcd2"},"decode":{"type":"uint8","offset":4,"minimum":0,"maximum":100}},{"code":"illuminance","name":"Illuminance","unit":"lux","input":{"kind":"serviceData","serviceUuid":"fcd2"},"decode":{"type":"uint24le","offset":6,"scale":0.01}},{"code":"motion","name":"Motion","unit":"status","input":{"kind":"serviceData","serviceUuid":"fcd2"},"decode":{"type":"bool","offset":10,"mask":1}}]}