{
  "$schema": "../../schemas/ble-profile-v1.schema.json",
  "schemaVersion": 1,
  "id": "blue-maestro-td3in1",
  "version": 1,
  "minimumRuntimeVersion": 1,
  "status": "experimental",
  "protocol": "Blue Maestro manufacturer advertisement",
  "match": { "manufacturerIds": [307] },
  "source": { "name": "Blue Maestro TD3in1 protocol facts documented by Theengs Decoder", "url": "https://decoder.theengs.io/devices/TD3in1.html", "license": "Protocol facts independently re-expressed in HomeController DeviceDB; Theengs Decoder implementation is GPL-3.0." },
  "fields": [
    { "code": "battery", "name": "Battery", "unit": "%", "input": { "kind": "manufacturerData", "manufacturerId": 307 }, "decode": { "type": "uint8", "offset": 3, "minimum": 0, "maximum": 100 } },
    { "code": "temperature", "name": "Temperature", "unit": "°C", "input": { "kind": "manufacturerData", "manufacturerId": 307 }, "decode": { "type": "int16be", "offset": 8, "scale": 0.1 } },
    { "code": "humidity", "name": "Humidity", "unit": "%", "input": { "kind": "manufacturerData", "manufacturerId": 307 }, "decode": { "type": "uint16be", "offset": 10, "scale": 0.1, "minimum": 0, "maximum": 100 } },
    { "code": "dewPoint", "name": "Dew point", "unit": "°C", "input": { "kind": "manufacturerData", "manufacturerId": 307 }, "decode": { "type": "int16be", "offset": 12, "scale": 0.1 } }
  ]
}
