{"$schema":"../../schemas/ble-profile-v1.schema.json","schemaVersion":1,"id":"xiaomi-body-composition-scale","version":1,"minimumRuntimeVersion":1,"status":"experimental","protocol":"Bluetooth Body Composition service-data advertisement","match":{"serviceDataUuids":["181b"]},"source":{"name":"Theengs Decoder XMTZC02HM/XMTZC05HM protocol facts","url":"https://github.com/theengs/decoder/blob/development/src/devices/XMTZC05HMKG_json.h","license":"Protocol facts independently re-expressed in HomeController DeviceDB; Theengs Decoder implementation is GPL-3.0.","notes":"Xiaomi Mi Body Composition Scale generations 1/2; hardware-unverified."},"fields":[{"code":"weighingMode","name":"Weighing mode","unit":"mode","input":{"kind":"serviceData","serviceUuid":"181b"},"decode":{"type":"uint8","offset":0,"mask":2}},{"code":"impedance","name":"Impedance","unit":"Ω","input":{"kind":"serviceData","serviceUuid":"181b"},"decode":{"type":"uint16le","offset":9}},{"code":"weight","name":"Weight","unit":"kg","input":{"kind":"serviceData","serviceUuid":"181b"},"decode":{"type":"uint16le","offset":11,"scale":0.005}}]}