{"$schema":"../../schemas/ble-profile-v1.schema.json","schemaVersion":1,"id":"jaalee-f525-f51c","version":1,"minimumRuntimeVersion":1,"status":"experimental","protocol":"Jaalee manufacturer data","match":{"serviceUuids":["f525","f51c"]},"source":{"name":"Theengs Decoder JAALEE protocol facts","url":"https://github.com/theengs/decoder/blob/development/src/devices/JAALEE_json.h","license":"Protocol facts independently re-expressed in HomeController DeviceDB; Theengs Decoder implementation is GPL-3.0.","notes":"F525/F51C TH sensor; 26-byte manufacturer payload; hardware-unverified."},"fields":[{"code":"temperature","name":"Temperature","unit":"°C","input":{"kind":"manufacturerData"},"decode":{"type":"uint16be","offset":20,"scale":0.0026703288319,"add":-45}},{"code":"humidity","name":"Humidity","unit":"%","input":{"kind":"manufacturerData"},"decode":{"type":"uint16be","offset":22,"scale":0.00152590218967}},{"code":"battery","name":"Battery","unit":"%","input":{"kind":"manufacturerData"},"decode":{"type":"uint8","offset":25}}]}