{"$schema":"../../schemas/ble-profile-v1.schema.json","schemaVersion":1,"id":"switchbot-bot","version":1,"minimumRuntimeVersion":1,"status":"experimental","protocol":"SwitchBot Bot BLE advertisement","match":{"serviceUuids":["0d00","fd3d"]},"source":{"name":"Theengs Decoder SBS1 research reference","url":"https://github.com/theengs/decoder/blob/development/src/devices/SBS1_json.h","license":"GPL-3.0 research reference only","notes":"Independent HomeController profile for SwitchBot Bot X1; hardware-unverified."},"fields":[{"code":"modeStateRaw","name":"Mode/state raw","input":{"kind":"serviceData","serviceUuid":"fd3d"},"decode":{"type":"uint8","offset":1}},{"code":"batteryRaw","name":"Battery raw","unit":"%","input":{"kind":"serviceData","serviceUuid":"fd3d"},"decode":{"type":"uint8","offset":2}}]}
