{"$schema":"../../schemas/ble-profile-v1.schema.json","schemaVersion":1,"id":"ruuvi-ruuvitag-rawv1","version":1,"minimumRuntimeVersion":1,"status":"experimental","protocol":"RuuviTag RAW v1 manufacturer advertisement","match":{},"source":{"name":"Theengs Decoder RuuviTag RAWv1 research reference","url":"https://github.com/theengs/decoder/blob/development/src/devices/RuuviTag_RAWv1_json.h","license":"GPL-3.0 research reference only","notes":"Independent HomeController profile. Manufacturer signature 990403; exposes humidity, temperature, pressure, acceleration and voltage; hardware-unverified."},"fields":[{"code":"humidityRaw","name":"Humidity raw","input":{"kind":"manufacturerData"},"decode":{"type":"uint8","offset":3}},{"code":"temperatureRaw","name":"Temperature raw","input":{"kind":"manufacturerData"},"decode":{"type":"uint16be","offset":4}},{"code":"pressureRaw","name":"Pressure raw","input":{"kind":"manufacturerData"},"decode":{"type":"uint16be","offset":6}},{"code":"accelerationXRaw","name":"Acceleration X raw","input":{"kind":"manufacturerData"},"decode":{"type":"int16be","offset":8}},{"code":"accelerationYRaw","name":"Acceleration Y raw","input":{"kind":"manufacturerData"},"decode":{"type":"int16be","offset":10}},{"code":"accelerationZRaw","name":"Acceleration Z raw","input":{"kind":"manufacturerData"},"decode":{"type":"int16be","offset":12}},{"code":"voltageRaw","name":"Voltage raw","input":{"kind":"manufacturerData"},"decode":{"type":"uint16be","offset":14}}]}
