{
  "$schema":"../../schemas/ble-profile-v1.schema.json",
  "schemaVersion":1,
  "id":"govee-h5106",
  "version":1,
  "minimumRuntimeVersion":1,
  "status":"experimental",
  "protocol":"Govee H5106 manufacturer advertisement",
  "match":{"namePatterns":["GVH5106*"]},
  "source":{"name":"Theengs Decoder H5106 research reference","url":"https://github.com/theengs/decoder/blob/development/src/devices/H5106_json.h","license":"GPL-3.0 research reference only","notes":"Independent HomeController profile. Advertisement contains packed temperature, humidity and PM2.5 data; hardware-unverified."},
  "fields":[
    {"code":"airQualityRaw","name":"Packed temperature/humidity/PM2.5","input":{"kind":"manufacturerData"},"decode":{"type":"uint32be","offset":4}}
  ]
}
