{"$schema":"../../schemas/ble-profile-v1.schema.json","schemaVersion":1,"id":"switchbot-blind-tilt","version":1,"minimumRuntimeVersion":1,"status":"experimental","protocol":"SwitchBot Blind Tilt BLE advertisement","match":{"serviceUuids":["0d00","fd3d"]},"source":{"name":"Theengs Decoder SBBT research reference","url":"https://github.com/theengs/decoder/blob/development/src/devices/SBBT_json.h","license":"GPL-3.0 research reference only","notes":"Independent HomeController profile for SwitchBot Blind Tilt W270160X; hardware-unverified."},"fields":[{"code":"openRaw","name":"Open raw","unit":"%","input":{"kind":"manufacturerData"},"decode":{"type":"uint8","offset":10}},{"code":"lightLevel","name":"Light level","input":{"kind":"manufacturerData"},"decode":{"type":"uint8","offset":9}},{"code":"batteryRaw","name":"Battery raw","unit":"%","input":{"kind":"serviceData","serviceUuid":"fd3d"},"decode":{"type":"uint8","offset":2}}]}
